{
  "$schema": "../attack.schema.json",
  "id": "forgotten-shield-counter",
  "notes": "The shield-bearer's slow counter-swing (mw-ju8.19): from 0-1.7 m every 7 s; it takes whichever of bash and counter is ready, so after a bash the counter follows.",
  "kind": "melee",
  "move": "forgotten-shield-counter",
  "telegraph": "forgotten-windup",
  "range": {
    "min": 0,
    "max": 1.7
  },
  "cooldown": 7,
  "weight": 1
}
